002:004:002:DESCRIPTOR         1589457613.954062
 05 01 09 06 A1 01 85 03 05 07 19 E0 29 E7 15 00
 25 01 75 01 95 08 81 02 05 07 19 00 29 FF 26 FF
 00 75 08 95 06 81 00 C0 05 0C 09 01 A1 01 85 04
 19 00 2A 3C 02 15 00 26 3C 02 95 01 75 10 81 00
 C0 05 01 09 80 A1 01 85 05 19 81 29 83 15 00 25
 01 75 01 95 03 81 02 95 05 81 01 C0

002:004:001:DESCRIPTOR         1589457613.955698
 05 01 09 02 A1 01 09 01 A1 00 85 01 05 09 19 01
 29 05 95 05 75 01 15 00 25 01 81 02 95 03 81 01
 05 01 09 30 09 31 95 02 75 10 16 00 80 26 FF 7F
 81 06 09 38 15 81 25 7F 95 01 75 08 81 06 05 0C
 0A 38 02 95 01 75 08 81 06 C0 C0 06 01 FF 09 00
 A1 01 85 08 15 00 26 FF 00 09 00 75 08 95 05 B1
 02 C0 05 0D 09 02 A1 01 85 0A 09 20 A1 00 09 42
 09 44 09 45 09 3C 09 43 09 44 15 00 25 01 75 01
 95 06 81 02 09 32 75 01 95 01 81 02 95 01 81 03
 05 01 09 30 09 31 55 0D 65 33 26 40 1F 35 00 46
 40 1F 75 10 95 02 81 02 05 0D 09 30 26 FF 1F 75
 10 95 01 81 02 C0 C0

002:004:000:DESCRIPTOR         1589457613.957427
 06 07 FF 09 00 A1 01 85 07 09 20 A1 00 09 42 09
 44 09 45 09 3C 09 43 09 44 15 00 25 01 75 01 95
 06 81 02 09 32 75 01 95 01 81 02 81 03 05 01 09
 30 75 10 95 01 A4 55 0D 65 13 35 00 46 C6 16 26
 B0 73 81 42 09 31 46 34 0D 26 12 43 81 42 B4 05
 0D 09 30 26 FF 1F 46 FF 1F 55 00 66 11 E1 75 10
 81 02 09 3D 15 81 25 7F 75 08 95 01 81 02 09 3E
 15 81 25 7F 81 02 C0 C0 05 01 09 02 A1 01 85 09
 09 01 A1 00 05 09 19 01 29 03 15 00 25 01 95 03
 75 01 81 02 95 05 81 01 05 01 09 30 09 31 95 02
 75 10 35 00 46 40 1F 26 40 1F 81 02 05 0D 09 30
 26 FF 1F 46 FF 1F 95 01 75 10 81 02 C0 C0

